<?xml version="1.0" encoding="ISO-8859-1"?>
<!--<logs xmlns:xsi="http://www.w3.org/2001/XMLSchema-instance" xsi:noNamespaceSchemaLocation="logs.xsd">-->
<logs>
    <log>
        <username>bruno</username>
        <name>Bruno</name>
        <date>2011-11-28T17:00:00</date>
        <action>SIP:ingestion</action>
        <description>Ingeriu um SIP</description>
    </log>
    <log>
        <username>miguel</username>
        <name>Miguel</name>
        <date>2011-11-28T17:30:00</date>
        <action>DIP:list</action>
        <description>Cenassa</description>
    </log>
    <log>
        <username>jcr</username>
        <name>Jose Carlos Ramalho</name>
        <date>2011-11-28T18:30:00</date>
        <action>DIP:View</action>
        <description>Projecto X visualizado</description>
    </log>
    <log>
        <username>jj</username>
        <name>JoseJoao</name>
        <date>2011-11-28T19:00:00</date>
        <action>SIP:Ingestion</action>
        <description>Ingestao</description>
    </log>
    <log>
        <username>vitor</username>
        <name>Vitor Costa</name>
        <date>2010-10-18T10:40:00</date>
        <action>DIP:Insert</action>
        <description>Inseriu projeto</description>
    </log>
</logs>